Title,Date,Link,Access Status
Integration of Near-Proximal and Proximal Lidar Sensing for Fine-Resolution Forest Inventory,"June 27, 2025",https://www.ingentaconnect.com/content/asprs/pers/pre-prints/content-24-00122,Unknown
Analysis of Landslide Susceptibility of the Darjeeling District Using a Frequency Ratio Model and Geographical Weighted Regression,"April 30, 2025",https://www.ingentaconnect.com/content/asprs/pers/pre-prints/content-24-00049,Unknown
"Enhancing Residential Building Identification in a Coastal Texas City: An Integrated Framework Leveraging Remote Sensing, GIS, and Transfer Learning Techniques","June 9, 2025",https://www.ingentaconnect.com/content/asprs/pers/pre-prints/content-24-00048,Unknown
Leadership in COVID-19: Mitigation Strategies across Top 30 Gross Domestic Product Countries,"May 7, 2025",https://www.ingentaconnect.com/content/asprs/pers/pre-prints/content-24-00046,Unknown
LFSA-YOLOv7&#65306;A Novel Method for Ship Detection in Remote Sensing Images with Complex Backgrounds,"June 17, 2025",https://www.ingentaconnect.com/content/asprs/pers/pre-prints/content-25-00015,Unknown
Efficient Coral Survey Using Aerial Remote Sensing and Multi-modal Segmentation for Large-Scale Ecological Assessment,"April 1, 2025",https://www.ingentaconnect.com/content/asprs/pers/pre-prints/content-25-00007,Unknown
Spatiotemporal Continuous Shallow Water Bathymetry from a Kriged Kalman Filter,"June 9, 2025",https://www.ingentaconnect.com/content/asprs/pers/pre-prints/content-24-00051,Unknown
On the Transferability of Semantic Segmentation for Very-High-Resolution Remote Sensing Data of Multi-City Environments,"June 25, 2025",https://www.ingentaconnect.com/content/asprs/pers/pre-prints/content-24-00140,Open Access content
Hierarchical Multi-Scale Cross Interaction Network for Enhanced Hyperspectral Image Classification,"June 23, 2025",https://www.ingentaconnect.com/content/asprs/pers/pre-prints/content-24-00114,Unknown
Lyme Disease Risk Map and Prioritizing Areas for Vaccine Deployment,"May 18, 2025",https://www.ingentaconnect.com/content/asprs/pers/pre-prints/content-2400045a,Unknown
