Month,Item Title,Item Type,DOI,Parent Title,Parent Type,Proprietary ID,ISSN,e-ISSN,ISBN,e-ISBN,Year,Volume,Issue,Total Downloads,Article Downloads,Preprint Downloads,PDF Downloads,HTML Downloads,Subscriber Downloads,Free Downloads,Open Access Downloads,Free Trial,Total Abstract Views,Article Abstract Views,Preprint Abstract Views,Publisher,Title,Abstract,Authors,Pages,Access,URL
2024/09,An Integrated Approach for Landslide Susceptibility Mapping Using Remote Sensing and GIS,Article,10.14358/pers.70.5.617,Photogrammetric Engineering & Remote Sensing,Journal,,0099-1112,,,,2004,70.0,5.0,45,45,0,45,0,0,0,45,0,316,316,0,American Society for Photogrammetry and Remote Sensing,,"A methodology for landslide susceptibility mapping using an integrated remote sensing and GIS approach is presented. A part of the Darjeeling Himalaya was selected for the model execution. IRS satellite data, topographic maps, field data, and other informative maps were used as inputs to the study. Important terrain factors, contributing to landslide occurrences in the region, were identified and corresponding thematic data layers were generated. These data layers represent the geological, topographical, and hydrological conditions of the terrain. A numerical rating scheme for the factors was developed for spatial data analysis in a GIS. The resulting landslide susceptibility map delineates the area into different zones of four relative susceptibility classes: high, moderate, low, and very low. The susceptibility map was validated by correlating the landslide frequencies of different classes. This has shown a close agreement with the existing field instability condition. The effectiveness of the map was also confirmed by the high statistically significant value of a chi-square test.","Sarkar, S., Kanungo, D.P.",,,https://doi.org/10.14358/pers.70.5.617
2024/09,A New Method for Segmenting Individual Trees from the Lidar Point Cloud,Article,10.14358/pers.78.1.75,Photogrammetric Engineering & Remote Sensing,Journal,,0099-1112,,,,2012,78.0,1.0,43,43,0,43,0,0,0,43,0,257,257,0,American Society for Photogrammetry and Remote Sensing,,"Light Detection and Ranging (lidar) has been widely applied to characterize the 3-dimensional (3D) structure of forests as it can generate 3D point data with high spatial resolution and accuracy. Individual tree segmentations, usually derived from the canopy height model, are used to derive individual tree structural attributes such as tree height, crown diameter, canopy-based height, and others. In this study, we develop a new algorithm to segment individual trees from the small footprint discrete return airborne lidar point cloud. We experimentally applied the new algorithm to segment trees in a mixed conifer forest in the Sierra Nevada Mountains in California. The results were evaluated in terms of recall, precision, and F-score, and show that the algorithm detected 86 percent of the trees (“recall”), 94 percent of the segmented trees were correct (“precision”), and the overall F-score is 0.9. Our results indicate that the proposed algorithm has good potential in segmenting individual trees in mixed conifer stands of similar structure using small footprint, discrete return lidar data.","Li, Wenkai, Guo, Qinghua, Jakubowski, Marek K., Kelly, Maggi",,,https://doi.org/10.14358/pers.78.1.75
2024/09,Remote Sensing Techniques to Assess Water Quality,Article,10.14358/pers.69.6.695,Photogrammetric Engineering & Remote Sensing,Journal,,0099-1112,,,,2003,69.0,6.0,39,39,0,39,0,0,0,39,0,334,334,0,American Society for Photogrammetry and Remote Sensing,,"Remote sensing techniques can be used to monitor water quality parameters (i.e., suspended sediments (turbidity), chlorophyll, and temperature). Optical and thermal sensors on boats, aircraft, and satellites provide both spatial and temporal information needed to monitor changes in water quality parameters for developing management practices to improve water quality. Recent and planned launches of satellites with improved spectral and spatial resolution sensors should lead to greater use of remote sensing techniques to assess and monitor water quality parameters. Integration of remotely sensed data, GPS, and GIS technologies provides a valuable tool for monitoring and assessing waterways. Remotely sensed data can be used to create a permanent geographically located database to provide a baseline for future comparisons. The integrated use of remotely sensed data, GPS, and GIS will enable consultants and natural resource managers to develop management plans for a variety of natural resource management applications.","Ritchie, Jerry C., Zimba, Paul V., Everitt, James H.",,,https://doi.org/10.14358/pers.69.6.695
2024/07,Direct Linear Transformation from Comparator Coordinates into Object Space Coordinates in Close-Range Photogrammetry,Article,10.14358/pers.81.2.103,Photogrammetric Engineering & Remote Sensing,Journal,,0099-1112,,,,2015,81.0,2.0,31,31,0,31,0,0,0,31,0,129,129,0,American Society for Photogrammetry and Remote Sensing,,"A method for photogrammetric data reduction without the necessity for neither fiducial marks nor initial approximations for inner and outer orientation parameters of the camera has been developed. This approach is particularly suitable for reduction of data from non-metric photography, but has also distinct advantages in its application to metric photography. Preliminary fictitious data tests indicate that the approach is promising. Experiments with real data are underway.","Abdel-Aziz, Y.I., Karara, H.M.",,,https://doi.org/10.14358/pers.81.2.103
2024/09,Landsat,Article,10.14358/pers.72.10.1171,Photogrammetric Engineering & Remote Sensing,Journal,,0099-1112,,,,2006,72.0,10.0,30,30,0,30,0,0,0,30,0,188,188,0,American Society for Photogrammetry and Remote Sensing,,"Landsat, first placed in orbit in 1972, established the U.S. as the world leader in land remote sensing. The Landsat system has contributed significantly to the understanding of the Earth’s environment, spawned revolutionary uses of space-based data by the commercial value-added industry, and encouraged a new generation of commercial satellites that provide regional, high-resolution spatial images. ThisPE&RSSpecial Issue provides an update to the 1997 25th Landsat anniversary issue, particularly focused on the contribution of Landsat-7 to the 34+year history of the Landsat mission. In this overview paper, we place the Landsat-7 system in context and show how mission operations have changed over time, increasingly exploiting the global monitoring capabilities of the Landsat observatory. Although considerable progress was made during the Landsat-7 era, there is much yet to learn about the historical record of Landsat global coverage: a truly valuable national treasure. The time to do so is now, as the memories of the early days of this historic program are fading as we speak.","Williams, Darrel L., Goward, Samuel, Arvidson, Terry",,,https://doi.org/10.14358/pers.72.10.1171
2024/07,Automated 3D Reconstruction of LoD2 and LoD1 Models for All 10 Million Buildings of the Netherlands,Article,10.14358/pers.21-00032r2,Photogrammetric Engineering & Remote Sensing,Journal,,0099-1112,,,,2022,88.0,3.0,24,24,0,24,0,0,0,24,0,131,131,0,American Society for Photogrammetry and Remote Sensing,,"In this paper, we present our workflow to automatically reconstruct three-dimensional (3D) building models based on two-dimensional building polygons and a lidar point cloud. The workflow generates models at different levels of detail (LoDs) to support data requirements of different applications from one consistent source. Specific attention has been paid to make the workflow robust to quickly run a new iteration in case of improvements in an algorithm or in case new input data become available. The quality of the reconstructed data highly depends on the quality of the input data and is monitored in several steps of the process. A 3D viewer has been developed to view and download the openly available 3D data at different LoDs in different formats. The workflow has been applied to all 10 million buildings of the Netherlands. The 3D service will be updated after new input data becomes available.","Peters, Ravi, Dukai, Balázs, Vitalis, Stelios, van Liempt, Jordi, Stoter, Jantien",,,https://doi.org/10.14358/pers.21-00032r2
2024/08,Analysis of Dynamic Thresholds for the Normalized Difference Water Index,Article,10.14358/pers.75.11.1307,Photogrammetric Engineering & Remote Sensing,Journal,,0099-1112,,,,2009,75.0,11.0,24,24,0,24,0,0,0,24,0,144,144,0,American Society for Photogrammetry and Remote Sensing,,"The normalized difference water index (NDWI) has been successfully used to delineate surface water features. However, two major problems have been often encountered: (a) NDWIs calculated from different band combinations [visible, near-infrared, or shortwave-infrared (SWIR)] can generate different results, and (b) NDWI thresholds vary depending on the proportions of subpixel water/non-water components. We need to evaluate all the NDWIs for determining the best performing index and to establish appropriate thresholds for clearly identifying water features. We used the spectral data obtained from a spectral library to simulate the satellite sensors Landsat ETM+, SPOT-5, ASTER, and MODIS, and calculated the simulated NDWI in different forms. We found that the NDWI calculated from (green – SWIR)/(green + SWIR), where SWIR is the shorter wavelength region (1.2 to 1.8 mm), has the most stable threshold. We recommend this NDWI be employed for mapping water, but adjustment of the threshold based on actual situations is necessary.","Ji, Lei, Zhang, Li, Wylie, Bruce",,,https://doi.org/10.14358/pers.75.11.1307
2024/09,Seeing the Trees in the Forest,Article,10.14358/pers.70.5.589,Photogrammetric Engineering & Remote Sensing,Journal,,0099-1112,,,,2004,70.0,5.0,23,23,0,23,0,0,0,23,0,156,156,0,American Society for Photogrammetry and Remote Sensing,,"The main study objective was to develop robust processing and analysis techniques to facilitate the use of small-footprint lidar data for estimating plot-level tree height by measuring individual trees identifiable on the three-dimensional lidar surface. Lidar processing techniques included data fusion with multispectral optical data and local filtering with both square and circular windows of variable size. The lidar system used for this study produced an average footprint of 0.65 m and an average distance between laser shots of 0.7 m. The lidar data set was acquired over deciduous and coniferous stands with settings typical of the southeastern United States. The lidar-derived tree measurements were used with regression models and cross-validation to estimate tree height on 0.017-ha plots. For the pine plots, lidar measurements explained 97 percent of the variance associated with the mean height of dominant trees. For deciduous plots, regression models explained 79 percent of the mean height variance for dominant trees. Filtering for local maximum with circular windows gave better fitting models for pines, while for deciduous trees, filtering with square windows provided a slightly better model fit. Using lidar and optical data fusion to differentiate between forest types provided better results for estimating average plot height for pines. Estimating tree height for deciduous plots gave superior results without calibrating the search window size based on forest type.","Popescu, Sorin C., Wynne, Randolph H.",,,https://doi.org/10.14358/pers.70.5.589
2024/09,Point Clouds,Article,10.14358/pers.76.10.1123,Photogrammetric Engineering & Remote Sensing,Journal,,0099-1112,,,,2010,76.0,10.0,22,22,0,22,0,0,0,22,0,123,123,0,American Society for Photogrammetry and Remote Sensing,,"Novel automated photogrammetry is based on four innovations. First is the cost-free increase of overlap between images when sensing digitally. Second is an improved radiometry. Third is multi-view matching. Fourth is the Graphics Processing Unit (GPU), making complex algorithms for image matching very practical. These innovations lead to improved automation of the photogrammetric workflow so that point clouds are created at sub-pixel accuracy, at very dense intervals, and in near real-time, thereby eroding the unique selling proposition of lidar scanners.Two test projects compare point clouds from aerial and street-side lidar systems with those created from images. We show that the photogrammetric accuracy compares well with the lidar-method, yet the density of surface points is much higher from images, and the throughput is commensurate with a fully automated all-digital approach. Beyond this density, we identify 15 additional advantages of the photogrammetric approach.","Leberl, F., Irschara, A., Pock, T., Meixner, P., Gruber, M., Scholz, S., Wiechert, A.",,,https://doi.org/10.14358/pers.76.10.1123
2024/09,Crop Yield Assessment from Remote Sensing,Article,10.14358/pers.69.6.665,Photogrammetric Engineering & Remote Sensing,Journal,,0099-1112,,,,2003,69.0,6.0,21,21,0,21,0,0,0,21,0,157,157,0,American Society for Photogrammetry and Remote Sensing,,"Monitoring crop condition and production estimates at the state and county level is of great interest to the U.S. Department of Agriculture. The National Agricultural Statistical Service (NASS) of the U.S. Department of Agriculture conducts field interviews with sampled farm operators and obtains crop cuttings to make crop yield estimates at regional and state levels. NASS needs supplemental spatial data that provides timely information on crop condition and potential yields. In this research, the crop model EPIC (Erosion Productivity Impact Calculator) was adapted for simulations at regional scales. Satellite remotely sensed data provide a real-time assessment of the magnitude and variation of crop condition parameters, and this study investigates the use of these parameters as an input to a crop growth model. This investigation was conducted in the semi-arid region of North Dakota in the southeastern part of the state. The primary objective was to evaluate a method of integrating parameters retrieved from satellite imagery in a crop growth model to simulate spring wheat yields at the sub-county and county levels. The input parameters derived from remotely sensed data provided spatial integrity, as well as a real-time calibration of model simulated parameters during the season, to ensure that the modeled and observed conditions agree. A radiative transfer model, SAIL (Scattered by Arbitrary Inclined Leaves), provided the link between the satellite data and crop model. The model parameters were simulated in a geographic information system grid, which was the platform for aggregating yields at local and regional scales. A model calibration was performed to initialize the model parameters. This calibration was performed using Landsat data over three southeast counties in North Dakota. The model was then used to simulate crop yields for the state of North Dakota with inputs derived from NOAA AVHRR data. The calibration and the state level simulations are compared with spring wheat yields reported by NASS objective yield surveys.","Doraiswamy, Paul C., Moulin, Sophie, Cook, Paul W., Stern, Alan",,,https://doi.org/10.14358/pers.69.6.665
2024/08,Remote Sensing for Crop Management,Article,10.14358/pers.69.6.647,Photogrammetric Engineering & Remote Sensing,Journal,,0099-1112,,,,2003,69.0,6.0,21,21,0,21,0,0,0,21,0,158,158,0,American Society for Photogrammetry and Remote Sensing,,"Scientists with the Agricultural Research Service (ARS) and various government agencies and private institutions have provided a great deal of fundamental information relating spectral reflectance and thermal emittance properties of soils and crops to their agronomic and biophysical characteristics. This knowledge has facilitated the development and use of various remote sensing methods for non-destructive monitoring of plant growth and development and for the detection of many environmental stresses which limit plant productivity. Coupled with rapid advances in computing and positionlocating technologies, remote sensing from ground-, air-, and space-based platforms is now capable of providing detailed spatial and temporal information on plant response to their local environment that is needed for site specific agricultural management approaches. This manuscript, which emphasizes contributions by ARS researchers, reviews the biophysical basis of remote sensing; examines approaches that have been developed, refined, and tested for management of water, nutrients, and pests in agricultural crops; and assesses the role of remote sensing in yield prediction. It concludes with a discussion of challenges facing remote sensing in the future.","Pinter, Jr., Paul J., Hatfield, Jerry L., Schepers, James S., Barnes, Edward M., Moran, M. Susan, Daughtry, Craig S.T., Upchurch, Dan R.",,,https://doi.org/10.14358/pers.69.6.647
2024/08,Approximating Prediction Uncertainty for Random Forest Regression Models,Article,10.14358/pers.82.3.189,Photogrammetric Engineering & Remote Sensing,Journal,,0099-1112,,,,2016,82.0,3.0,20,20,0,20,0,0,0,20,0,97,97,0,American Society for Photogrammetry and Remote Sensing,,"Machine learning approaches such as random forest have increased for the spatial modeling and mapping of continuous variables. Random forest is a non-parametric ensemble approach, and unlike traditional regression approaches there is no direct quantification of prediction error. Understanding prediction uncertainty is important when using model-based continuous maps as inputs to other modeling applications such as fire modeling. Here we use a Monte Carlo approach to quantify prediction uncertainty for random forest regression models. We test the approach by simulating maps of dependent and independent variables with known characteristics and comparing actual errors with prediction errors. Our approach produced conservative prediction intervals across most of the range of predicted values. However, because the Monte Carlo approach was data driven, prediction intervals were either too wide or too narrow in sparse parts of the prediction distribution. Overall, our approach provides reasonable estimates of prediction uncertainty for random forest regression models.","Coulston, John W., Blinn, Christine E., Thomas, Valerie A., Wynne, Randolph H.",,,https://doi.org/10.14358/pers.82.3.189
2024/09,Real-Time Cross-View Image Matching and Camera Pose Determination for Unmanned Aerial Vehicles,Article,10.14358/pers.23-00073r2,Photogrammetric Engineering & Remote Sensing,Journal,,0099-1112,,,,2024,90.0,6.0,20,20,0,20,0,0,0,20,0,93,93,0,American Society for Photogrammetry and Remote Sensing,,"In global navigation satellite systems (GNSS)-denied environments, vision-based methods are commonly used for the positioning and navigation of aerial robots. However, traditional methods often suffer from accumulative estimation errors over time, leading to trajectory drift and lack real-time performance, particularly in large-scale scenarios. This article presents novel approaches, including feature-based cross-view image matching and the integration of visual odometry and photogrammetric space resection for camera pose determination in real-time. Experimental evaluation with real UAV datasets demonstrated that the proposed method reliably matches features in cross-view images with large differences in spatial resolution, coverage, and perspective views, achieving a root-mean-square error of 4.7 m for absolute position error and 0.33° for rotation error, and delivering real-time performance of 12 frames per second (FPS) when implemented in a lightweight edge device onboard UAV. This approach offters potential for diverse intelligent UAV applications in GNSS-denied environments based on real-time feedback control.","Chen, Long, Wu, Bo, Duan, Ran, Chen, Zeyu",,,https://doi.org/10.14358/pers.23-00073r2
2024/09,Photogrammetric Techniques in Civil Engineering Material Testing and Structure Monitoring,Article,10.14358/pers.72.1.39,Photogrammetric Engineering & Remote Sensing,Journal,,0099-1112,,,,2006,72.0,1.0,19,19,0,19,0,0,0,19,0,82,82,0,American Society for Photogrammetry and Remote Sensing,,"Civil engineering material testing includes a wide range of applications requiring the determination of the three-dimensional shape of an object and changes thereof. Large structure monitoring will often include the necessity of determining object deformations at a large number of points. Photogrammetric techniques offer a large potential for the solution of a wide range of measurement tasks in this field. A modular toolbox consisting of digital cameras, computer interfaces, illumination systems, calibration devices, combined with subpixel accuracy image measurement operators, multi-image matching techniques, and self-calibrating bundle adjustment in a suitable user interface, depicts a very powerful tool for tailoring custom-made solutions for material testing labs. Due to the wide range and the repetitive nature of measurements tasks in civil engineering, these applications could depict a significant future market for photogrammetry.This paper will briefly discuss the major hardware and software modules of a toolbox for civil engineering material testing and large structure monitoring. Based on several sample applications covering object dimensions from 10 cm to 500 meters, the potential of photogrammetric deformation measurement techniques will be shown. The major advantage of photogrammetric techniques can often be seen in the fact that they allow for highly automated measurements at a large number of points simultaneously. In many cases, object deformations can be determined at a precision in the order of 1:100,000 of the object dimension, based on off-the-shelf hardware components.","Maas, Hans-Gerd, Hampel, Uwe",,,https://doi.org/10.14358/pers.72.1.39
2024/09,A Comparison of Vector and Raster GIS Methods for Calculating Landscape Metrics Used in Environmental Assessments,Article,10.14358/pers.69.12.1399,Photogrammetric Engineering & Remote Sensing,Journal,,0099-1112,,,,2003,69.0,12.0,18,18,0,18,0,0,0,18,0,85,85,0,American Society for Photogrammetry and Remote Sensing,,"GIS-based measurements that combine native raster and native vector data are commonly used in environmental assessments. Most of these measurements can be calculated using either raster or vector data formats and processing methods. Raster processes are more commonly used because they can be significantly faster computationally than vector, but error is introduced in converting vector data to raster. This conversion error has been widely studied and quantified, but the impact on environmental assessment results has not been investigated. We examined four GIS-based measurements commonly used in environmental assessments for approximately 1000 watersheds in the state of Maryland and Washington, D.C. Each metric was calculated using vector and raster methods, and estimated values were compared using a paired t-test, Spearman rank correlation, and cluster analyses. Paired t-tests were used to determine the statistical significance of quantitative differences between methods, and Spearman rank correlation and cluster analyses were used to evaluate the impact of the differences on environmental assessments. Paired t-test results indicated significant quantitative differences between methods for three of the four metrics. However, Spearman ranks and cluster analyses indicated that the quantitative differences would not affect environmental assessment results. Spearman rank correlations between vector and raster values were greater than 0.98 for all comparisons. Cluster analyses resulted in identical assignment for 88 percent to over 98 percent of watersheds analyzed among vector and various raster methods.","Wade, Timothy G., Wickham, James D., Nash, Maliha S., Neale, Anne C., Riitters, Kurt H., Jones, K. Bruce",,,https://doi.org/10.14358/pers.69.12.1399
