Title,Date,Link,Access Status
Efficient Coral Survey Using Aerial Remote Sensing and Multi-modal Segmentation for Large-Scale Ecological Assessment,"April 1, 2025",https://www.ingentaconnect.com/content/asprs/pers/pre-prints/content-25-00007,Subscribed content
Phase Center Extraction of Corner Reflector Points in Single-Look Complex Image,"April 8, 2025",https://www.ingentaconnect.com/content/asprs/pers/pre-prints/content-24-00101,Subscribed content
Combined Use of Satellite Observations and the RIM for Assessing Recovery from Natural Disasters,"April 1, 2025",https://www.ingentaconnect.com/content/asprs/pers/pre-prints/content-pers_24-00050,Open Access content
A High-Quality Underwater 3D Reconstruction Solution for Coral Reef Environments Leveraging Advanced Photogrammetric Computer Vision Techniques,"April 7, 2025",https://www.ingentaconnect.com/content/asprs/pers/pre-prints/content-24-00156,Subscribed content
Texture-Semantic Point: Registration for Point Clouds of Porcelain Relics,"April 8, 2025",https://www.ingentaconnect.com/content/asprs/pers/pre-prints/content-24-00116,Subscribed content
