Title,Authors,Pages,Access,URL,Abstract,PubDate,DOI,Citations,ParsedDate
Real-time Vanishing Point Tracking in Manhattan World Using Improved BaySAC,"Ye, Chenming; Kang, Zhizhong; Cai, Jinhao; Zhu, Longze",pp. 175-186(12),,https://www.ingentaconnect.com/contentone/asprs/pers/2025/00000091/00000003/art00013;jsessionid=jm2wajzzvth3.x-ic-live-02,"Vanishing points provide geometric information about a scene and assist in camera calibration, scene understanding, and 3D reconstruction. The random sample consensus (RANSAC) algorithm faces challenges of low efficiency and insufficient robustness. With prior information, the Bayesian sample consensus (BaySAC) algorithm can efficiently derive the correct parameters and compensate for the deficiencies of the RANSAC algorithm. This study proposes an improved BaySAC vanish - ing point detection algorithm, which uses a linear grouping strategy to enhance the distribution of inliers across groups and accelerate convergence. In the continuous frame vanishing point tracking problem, the detection result of the previous frame is employed as a priori infor - mation for the subsequent frames, facilitating efficient convergence for vanishing point detection and tracking in videos. Experimental results on both benchmark datasets and real-world image sets demonstrate that the proposed method achieves remarkable accuracy and efficiency, enabling real-time performance for vanishing point detection and track- ing. The code is available at https://github. com/CHEMYE/BaySAC.",,,0,2025-03-01
"Ready, Set, Modernize – ASPRS Takes on Preparing the Geospatial Industry for the Modernized National Spatial Reference System (NSRS)","Parrish, Christopher; Abdullah, Qassim; Foster, Linda; White, Stephen; Borberg, Jenna",pp. 645-651(7),Open Access content,https://www.ingentaconnect.com/contentone/asprs/pers/2024/00000090/00000011/art00003;jsessionid=e65g47dvtlrt.x-ic-live-01,"The National Geodetic Survey (NGS) is modernizing the National Spatial Reference System (NSRS) in the United States. The modernization involves significant updates to the official reference frames and vertical datum used across the country, affecting the entire geospatial industry. Key benefits of the Modernized NSRS will include improved accuracies and enhanced interoperability and sustainability of geospatial data and systems. The ASPRS NSRS Modernization Working Group produced this paper to help prepare the geospatial industry for the upcoming changes. It serves as a guide for industry professionals to understand the implications of the Modernized NSRS and recommendations to begin preparing for it. It emphasizes the importance of proactive measures to ensure a smooth transition to the new reference frames and vertical datum.",,,0,2024-11-01
Artificial Neural Network Multi-layer Perceptron Models to Classify California's Crops using Harmonized Landsat Sentinel (HLS) Data,"McCormick, Richard; Thenkabail, Prasad S.; Aneece, Itiya; Teluguntla, Pardhasaradhi; Oliphant, Adam J.; Foley, Daniel",pp. 91-100(10),Open Access content,https://www.ingentaconnect.com/contentone/asprs/pers/2025/00000091/00000002/art00010;jsessionid=oun1mw0p67lv.x-ic-live-03,"Advances in remote sensing and machine learning are enhancing cropland classification, vital for global food and water security. We used multispectral Harmonized Landsat 8 Sentinel-2 (HLS) 30-m data in an artificial neural network (ANN) multi-layer perceptron (MLP) model to classify five crop classes (cotton, alfalfa, tree crops, grapes, and others) in California's Central Valley. The ANN MLP model, trained on 2021 data from the United States Department of Agriculture's Cropland Data Layer, was validated by classifying crops for an independent year, 2022. Across the five crop classes, the overall accuracy was 74%. Producer's and user's accuracies ranged from 65% to 87%, with cotton achieving the highest accuracies. The study highlights the potential of using deep learning with HLS time series data for accurate global crop classification.",,,0,2025-02-01
The Aboveground Carbon Stock of Moso Bamboo Forests Is Significantly Reduced byPantana phyllostachysaeChao Stress: Evidence from Multi-source Remote Sensing Imagery,"Yang, Yuanyao; Xu, Zhanghua; Chen, Lingyan; Shen, Wanling; Li, Haitao; Zhang, Chaofei; Sun, Lei; Guo, Xiaoyu; Guan, Fengying",pp. 213-224(12),Subscribed content,https://www.ingentaconnect.com/contentone/asprs/pers/2025/00000091/00000004/art00011;jsessionid=4er1wfoj21hut.x-ic-live-02,"This study estimated aboveground carbon stock (AGC) using field data and integrated multi-source remote sensing imagery to understand the effects of Pantana phyllostachysae Chao (P. phyllostachysae) stress. AGC remote sensing inversion was performed while accounting for P. phyllostachysae stress, and changes were analyzed. Results indicate: (1) Carbon content coefficients of Moso bamboo leaves, branches, and culms under pest stress ranged from 0.422 to 0.543 g/g, decreasing with increased stress. (2) A random forest model using multi-source data demonstrated the best performance (R2 = 0.688), estimating average AGC at 28.427 t/ha and total carbon sequestration at 913.902 MtC (Million tons of Carbon). (3) Increased pest stress resulted in gradual reductions in AGC. (4) Pest stress is estimated to result in a carbon sequestration loss of 77.443 MtC. The AGC estimation model indicates thatP. phyllostachysaesignificantly reduces AGC, providing crucial data for understanding carbon cycling and enhancing carbon sink management in Moso bamboo forests.",,,0,2025-04-01
Lightweight and Accurate Video Synthetic Aperture Radar Target Detection Network,"Ma, Huilian; Li, Yinwei; Li, Weisong; Zhu, Yiming",pp. 573-581(9),Subscribed content,https://www.ingentaconnect.com/contentone/asprs/pers/2025/00000091/00000009/art00011;jsessionid=7089s3elc130c.x-ic-live-03,"Video synthetic aperture radar (SAR) target detection has seen rapid development in recent years, but current methods generally suffer from high computational complexity as well as frequent false alarms and missed alarms. Additionally, in video SAR scenarios, small targets become more difficult to identify due to low resolution and complex backgrounds. Recently, leveraging shadows for video SAR moving target detection has proven advantageous as it provides accurate location information and additional boundary details. To address the challenges of target detection in video SAR caused by low resolution and complex backgrounds, as well as the high computational cost of current methods, this paper proposes a lightweight algorithm for video SAR shadow detection based on the YOLOv5 architecture, named Lavs-DeNet. First, a lightweight feature extraction backbone network combining both global and local information called CGLLNet is proposed. This backbone improves the detection performance by mitigating false alarms and missed alarms caused by defocus in video SAR images. Next, a slanted ladder bidirectional feature pyramid network (SL‐BiFPN) is designed. By using tilted upsampling with multiple stacked layers, this network efficiently extracts multi-scale features, further reducing missed alarms. Finally, a lightweight information interaction module (LII‐C3) has been developed, significantly reducing computational complexity. To validate the effectiveness of the proposed method, experiments were conducted using the data set released by Sandia National Laboratories. The experimental results show that the proposed Lavs-DeNet can achieve 97.88% detection accuracy, requiring only 21.02G floating points and 0.88M parameters, which is superior to the current classical video SAR target detection networks.",,,0,2025-09-01
LFSA‐YOLOv7: A Novel Method for Ship Detection in Remote Sensing Images with Complex Backgrounds,"Gu, Heng; Li, Wei; Zhang, Linlin; Meng, Qingyan; Wei, Lianhuan; Wu, Hantian; Ma, Jian",pp. 563-571(9),Subscribed content,https://www.ingentaconnect.com/contentone/asprs/pers/2025/00000091/00000009/art00009;jsessionid=7089s3elc130c.x-ic-live-03,"Ship target detection is a critical component for marine environmental monitoring and the protection of maritime rights and interests. However, existing methods for ship detection in remote sensing imagery often face challenges such as false positives and missed detections, particularly in the presence of complex backgrounds and multi-scale targets. To address these issues, we propose a novel method called LFSA‐YOLOv7, (LDConv {Linear Deformable Convolution}; SPPFCSPC‐G {Spatial Pyramid Pooling Fast Cross Stage Partial Channel ‐ Group}, SimAM{Simple Attention Module}, and Alpha‐CoIoU {Alpha‐Coordinate Point Orienta tion ‐ Intersection over Union}) which is designed to enhance the accuracy and robustness of ship detection in complex backgrounds: (a) a novel network architecture (LDConv + SPPFCSPC‐G + SimAM) to enhance the model’s ship detection capabilities, and (b) a novel Alpha‐CoIoU loss function to improve the model’s ship localization accuracy. To evaluate the performance of our algorithm in complex backgrounds, we have developed a novel ship classification detection (SCD) data set and conducted comprehensive experiments. Furthermore, we have validated the generalization of our algorithm across various remote sensing ship data sets. The experimental results demonstrate that our algorithm outperforms previous techniques, exhibiting strong generalization and robustness, making it effectively suitable for ship detection in complex backgrounds. The SCD data set and code will be available at https://github.com/wionn/LFSA-YOLOv7.git.",,,0,2025-09-01
Crack Parameter Determination Based on Multiple-Window Matching Strategy and Crack Grid Geometry Analysis,"Tong, Xiaohua; Gao, Sa; Ye, Zhen; Chen, Peng; Liu, Shijie; Xie, Huan; Liu, Xianglei; Hong, Zhonghua; Zhang, Dezhi; Yang, Jun; Song, Yanfeng; Lv, Hongpeng; Cao, Dong",pp. 551-562(12),Subscribed content,https://www.ingentaconnect.com/contentone/asprs/pers/2025/00000091/00000009/art00008;jsessionid=7089s3elc130c.x-ic-live-03,"Accurate deformation measurement of building materials has consistently been a focal point of research within the field of material testing. This paper proposes a robust 3D crack parameter estimation approach to measure the crack propagation characteristics of concrete pillars under compression testing. Through the use of an improved multiple-window matching strategy and other advanced image processing algorithms, the precise positional information of speckle target points can be calculated in speckle image sequences. 3D point cloud data and full-field deformation of target points on the concrete pillar surface can be further calculated through photogrammetric analysis and spatiotemporal analysis, respectively. Finally, a robust crack estimation algorithm based on grid geometry analysis is proposed to extract accurate crack parameters in the presence of complex speckle texture interference. To verify the superiority and reliability of the proposed approach, both a simulation test and an empirical test were conducted. The experimental results, including positional comparisons with previous matching strategies and displacement comparisons with third-party equipment, corroborate the effectiveness of our method.",,,0,2025-09-01
Hierarchical Multi-Scale Cross Interaction Network for Enhanced Hyperspectral Image Classification,"Feng, Yuting; Yang, Lina; Wu, Thomas; Huang, Youju",pp. 495-507(13),Subscribed content,https://www.ingentaconnect.com/contentone/asprs/pers/2025/00000091/00000008/art00010;jsessionid=3qfmtrbm2rj7l.x-ic-live-02,"The significance of hyperspectral image classification lies in its ability to discern subtle differences between materials, making it essential in fields such as agriculture, mineral exploration, and urban planning. Convolutional neural networks (CNNs) and transformer-based methods have become standard for hyperspectral imagery classification, with hybrid approaches gaining popularity. Yet, these methods often lack efficient interaction between the features extracted by CNNs and transformers. To address this, we propose the hierarchical multiscale cross interaction network (HMCI-Net), which leverages both CNNs and transformers to enhance classification accuracy. The CNN branch extracts local spatial-spectral features, and the transformer branch captures global spectral information, allowing the network to model long-range dependencies and complex correlations. Additionally, HMCI-Net incorporates a hierarchical multi-scale feature extraction module and a multi-view feature fusion module, further improving its ability to extract fine-grained, multi-perspective features. Extensive experiments on four benchmark hyperspectral data sets—Indian Pines, Pavia University, WHU-Hi-LongKou, and Houston2013—demonstrate that HMCI-Net outperforms existing methods, achieving an average improvement of 6.24% in average accuracy, 6.14% in kappa coefficient, and 5.55% in overall accuracy. Specifically, HMCI-Net achieves significant gains, with overall accuracy higher by 8.86%, 4.34%, 4.44%, and 4.42% on Indian Pines, Pavia University, WHU-HiLongKou, and Houston2013, respectively. Similarly, average accuracy is higher by 10.57%, 4.94%, 5.65%, and 4.81% for Indian Pines, Pavia University, WHU-Hi-LongKou, and Houston2013, respectively; kappa coefficient is higher by 10.39%, 4.88%, 4.70%, and 4.60%, respectively, on these data sets. The code and data set for this paper can be accessed at: https://github.com/codemanvon30/HMCI_Net.",,,0,2025-08-01
Combined Use of Satellite Observations and the RIM for Assessing Recovery from Natural Disasters,"Cao, Changyong; Wang, Wenhui; Bai, Yan; Shao, Xi; Uprety, Sirish; Qiu, Hong-Lie",pp. 407-417(11),Open Access content,https://www.ingentaconnect.com/contentone/asprs/pers/2025/00000091/00000007/art00010;jsessionid=1qoo44coqc4mt.x-ic-live-02,"In this study, we explore using satellite observations to assess community recovery from natural disasters such as fires and hurricanes, supplementing the Resilience Inference Model (RIM). The RIM model has been successfully used to quantify recoveries from hurricanes along the Gulf Coast, but it relies on long-term population changes over years or decades. Our approach integrates satellite observations to enhance recovery assessment with a shorter latency of weeks or months. Using fire, vegetation, and night light data from the Visible Infrared Imaging Radiometer Suite (VIIRS) with daily global observations, Sentinel-2, Landsat-8, and Geostationary Operational Environmental Satellite/Advanced Baseline Imager, we quantitatively evaluate fire intensity, light outage, and urban greenness changes, along with subsequent recovery, focusing on the 2023 Maui fire and selected hurricane cases along the Gulf Coast. This approach complements the RIM model by introducing quantifiable physical parameters with shorter latency, particularly beneficial in areas where census data are either unavailable or unreliable.",,,0,2025-07-01
Phase Center Extraction of Corner Reflector Points in Single-Look Complex Image,"Zhao, Ruishan; Yu, Zhi; Wang, Libo; Chen, Chunsen; Huang, Wenchao; Dai, Jiguang",pp. 371-381(11),Open Access content,https://www.ingentaconnect.com/contentone/asprs/pers/2025/00000091/00000006/art00015;jsessionid=1oli2sde03kjw.x-ic-live-02,"The geometric calibration accuracy of the Synthetic Aperture Radar (SAR) system is affected by the extraction accuracy of Corner Reflector (CR) points in a Single-Look Complex (SLC) image. There are some problems in traditional artificial extraction methods for CR points, such as the difficulty of identifying CR points without prior knowledge, low efficiency, and limited extraction accuracy. An extraction method of the phase center for CR points without prior knowledge was proposed in this paper through the construction of a geometric error compensation model for SAR images and the study of high precision fitting methods of the phase center for CR points. The effectiveness of the proposed method was verified by the Gaofen-3 (GF-3) satellite image data. Experimental results demonstrated that the extraction accuracy of CR points could be better than 0.2 pixel for GF-3 images.",,,0,2025-06-01
Leadership in COVID-19: Mitigation Strategies across Top 30 Gross Domestic Product Countries,"Ozdenerol, Esra; Bingham-Byrne, Rebecca Michelle",pp. 433-442(10),,https://www.ingentaconnect.com/contentone/asprs/pers/2025/00000091/00000007/art00014;jsessionid=1qoo44coqc4mt.x-ic-live-02,"This study analyzes COVID-19 response strategies in the top 30 gross domestic product countries from the first case until 30 September 2021, a period marked by increased vaccinations, the dominance of the Delta variant, and changing public health measures. We examined which mitigation efforts effectively reduced new cases and the viral reproduction rate. Vaccination policies, movement restrictions, and mask mandates were critical in reducing cases per million, while testing, public information, income support, and contact tracing were crucial for lowering the viral reproduction rate. Vaccination policies did not significantly affect the reproduction rate during implementation. The gender of leaders showed no significant effect on cases, deaths, or excess mortality, though female leaders generally implemented fewer isolation days and prioritized additional measures like movement restrictions and stay-at-home orders.",,,0,2025-07-01
An Efficient Irregular Texture Nesting Method via Hybrid NFP-SADE with Adaptive Container Resizing,"Lou, Liyuan; Li, Wanyun; Yu, Jingle; Wang, Xin; Zhan, Zongqian",pp. 681-691(11),,https://www.ingentaconnect.com/contentone/asprs/pers/2025/00000091/00000011/art00008;jsessionid=5mho1n1q3hadi.x-ic-live-03,"Efficient irregular texture nesting, which is necessary for improving the efficiency of texture mapping and 3D model rendering, especially for large-scale 3D reconstruction tasks, has emerged as a critical research topic in the fields of photogrammetry, computer graphics, and computer vision. However, persistent inefficiencies and high computational costs in existing texture nesting algorithms pose significant challenges when dealing with vast quantities of irregularly shaped texture patches. To solve this problem, this work presents an efficient and well structured texture nesting for reorganizing irregular textures in a space efficient and time efficient way. More specifically, a hybrid optimization approach that integrates an enhanced no fit polygon (NFP) method with an improved simplified atavistic differential evolution (SADE) algorithm is proposed. The canonical SADE is reformulated, tailored for texture nesting optimization, and a novel self-adaptive container resizing strategy is used to surpass traditional NFP approaches in polygon processing efficiency. The experimental results demonstrate that the proposed method significantly improves irregular texture nesting efficiency, achieving speed improvements of up to 5.44 times compared with the common genetic algorithm–based method and 5.21 times over the simulated annealing–based method. Furthermore, it consistently improves space use by approximately 6.56%, indicating a more effective layout strategy and optimized resource use. Code is available at https:// github. com/louliyuan/NFP-SADE-With-Adaptive-Container-Resizing.",,,0,2025-11-01
A Novel Multi-level Feature Collaborative Matching Network for Optical and Synthetic Aperture Radar Image Registration,"Pang, Bo; Wang, Lei; Wei, Bo; Zhu, Wenlei; Gao, Haiyun",pp. 753-761(9),,https://www.ingentaconnect.com/contentone/asprs/pers/2025/00000091/00000012/art00011;jsessionid=1ipqro8bok43i.x-ic-live-02,"Due to the complementary characteristics of synthetic aperture radar (SAR) and optical images, image registration as a prerequisite for their information fusion has received increasing attention. Currently, learning-based methods can better handle the significant radiometric and geometric differences between optical and SAR images compared to traditional registration approaches, but they still have limitations in distinguishing difficult samples, making high-precision registration a remaining challenge. To address these challenges, this paper proposes a multi-level feature collaborative matching network (MFC-Net) that effectively integrates high-level abstract features and low-level spatial features for precise registration. Furthermore, a novel dual-dimension joint attention module (DDJA) is designed to dynamically capture feature dependencies across both channel and spatial dimensions, enhancing cross-modal feature consistency and improving matching performance. Additionally, to address the problem of similarity between hard positive and negative samples caused by high-precision registration requirements, a dynamic differentiation factor is introduced at the loss function level, enabling the model to better distinguish between these similar samples in training. Extensive experiments conducted on the WHU-OPT-SAR data set and WHU-SENCity data set demonstrate that the proposed MFC-Net outperforms state-of-the-art methods in both matching accuracy and precision, validating its superiority in cross-modal image registration tasks.",,,0,2025-12-01
Novel Spatiotemporal ConvLSTM-Based Cellular Automata Model for Simulating Urban Expansion,"Zhou, Ye; Qiu, Yu; Wu, Tao; Lv, Laishui",pp. 715-726(12),,https://www.ingentaconnect.com/contentone/asprs/pers/2025/00000091/00000011/art00013;jsessionid=5mho1n1q3hadi.x-ic-live-03,"Accurately capturing and simulating the spatiotemporal dynamics of urban expansion remains a persistent challenge in urban planning and environmental management. Traditional machine learning methods often struggle to capture the complexity of spatial features and the multi-scale spatiotemporal dynamics involved in deriving the transition rules of cellular automata (CA), making it difficult to balance detailed local expansion with broader overall trends during the urban expansion simulation process. To address these challenges, we propose a novel spatiotemporal CA model based on the convolutional long short-term memory (ConvLSTM) neural network. This model, termed ST-ConvLSTM-CA, simultaneously enhances critical spatial features and incorporates multi-scale spatiotemporal features by integrating the shuffle attention mechanism and a spatiotemporal expression (SE) block into the ConvLSTM architecture. First, the channel dimensions of spatial features are grouped and channel spatial attention is performed in parallel, allowing for efficient fusion and weighting of key spatial features with minimal computational cost. Second, the SE module is used to integrate the multi-scale information within ConvLSTM cells, enhancing the representation of neighborhood details across different spatial granularities and capturing dynamic temporal features. Finally, the improved model generates conversion probability maps, which are used by the CA model to simulate time series urban expansion maps. Using the urban agglomerations of the Guangdong-Hong Kong-Macao Greater Bay Area, the Yangtze River Delta, and Beijing-Tianjing-Tangshan as case studies, results show that ST-ConvLSTM-CA achieves the highest accuracy across all three regions. This demonstrates its robust adaptability to complex spatiotemporal data and superior predictive performance.",,,0,2025-11-01
Convolutional Neural Networks for Land Use and Land Cover Multi-class Maps from Historical Aerial Photographs,"Kostrzewa, Adam",pp. 631-645(15),Open Access content,https://www.ingentaconnect.com/contentone/asprs/pers/2025/00000091/00000010/art00011;jsessionid=3co9c5gsl9nev.x-ic-live-03,"Historical maps that describe past land use and land cover (LULC) forms can be a precious source of information in many scientific fields studying long-term spatial and temporal changes in the landscape. Such repositories were created manually in small areas in the past, which was a time-consuming and labor-intensive task. Recently, there has been a growing tendency to use machine learning models for this purpose, along with deep learning methods. However, having a massive amount of labeled data is necessary for these methods to train the networks. Training data are often manually labeled, posing a significant challenge and limiting the automation of these methods. This article presents a method that uses topographic databases to extract complex multi-class maps representing LULC from historical aerial photographs, eliminating the time-consuming data labeling step. The method uses transfer learning with a pretrained model on 2020 and 2014 data and attempts to reconstruct LULC types with the same convolutional neural network (CNN) network on archived images from 2006. The experiment covered 488 km2and included seven LULC classes. The method was tested using different CNN architectures (U-Net, Pyramid Scene Parsing Network [PSPNet], and LinkNet) with backbones (ResNeXt+SE, EfficientNet, and Inception). The PSPNet‐EfficientNet‐b7 network model achieved the best results, with 90% overall accuracy for predicting LULC classes based on the 2006 archived aerial images.",,,0,2025-10-01
