Title,Authors,Pages,Access,URL,Abstract,PubDate,DOI,Citations,ParsedDate
Image Fusion in Remote Sensing: An Overview and Meta-Analysis,"Albanwan, Hessah; Qin, Rongjun; Tang, Yang",pp. 755-775(21),Open Access content,https://www.ingentaconnect.com/contentone/asprs/pers/2024/00000090/00000012/art00012;jsessionid=9a8ib0ew1wvq.x-ic-live-03,"Remote sensing image fusion is consistently used to turn raw images of different resolutions, sources, and modalities into accurate, complete, and spatiotemporally coherent images. It facilitates downstream applications such as pan sharpening, change detection, and classification. However, image fusion solutions are highly disparate to various remote sensing problems and are often narrowly defined in existing reviews as topical applications (e. g., pan sharpening). Theoretically, image fusion can be applied to any gridded data through pixel-level operations; thus, we expand its scope by comprehensively surveying relevant works. We develop a simple taxonomy for many-to-one and many-to-many image fusion, defining it as a mapping problem turning one or multiple images into another set based on desired coherence. Furthermore, we provide a meta-analysis to cover 10,420 peer-reviewed papers from the 1980s to 2023 studying various types of image fusion and their applications. Finally, we discuss image fusion's benefits and emerging challenges to provide open research directions.",,,20,2024-12-01
Machine Learning and New-Generation Spaceborne Hyperspectral Data Advance Crop Type Mapping,"Aneece, Itiya; Thenkabail, Prasad S.; McCormick, Richard; Alifu, Haireti; Foley, Daniel; Oliphant, Adam J.; Teluguntla, Pardhasaradhi",pp. 687-698(12),Open Access content,https://www.ingentaconnect.com/contentone/asprs/pers/2024/00000090/00000011/art00012;jsessionid=vj4y1qllys3s.x-ic-live-02,"Hyperspectral sensors provide near-continuous spectral data that can facilitate advancements in agricultural crop classification and characterization, which are important for addressing global food and water security issues. We investigated two new-generation hyperspectral sensors, Germany’s Deutsches Zentrum für Luft‐ und Raumfahrt Earth Sensing Imaging Spectrometer (DESIS) and Italy’s PRecursore IperSpettrale della Missione Applicativa (PRISMA), within California???s Central Valley in August 2021 focusing on five irrigated agricultural crops (alfalfa, almonds, corn, grapes, and pistachios). With reference data from the U.S. Department of Agriculture Cropland Data Layer, we developed a spectral library of the crops and classified them using three machine learning algorithms (support vector machines [SVM], random forest [RF], and spectral angle mapper [SAM]) and two philosophies: 1. Full spectral analysis (FSA) and 2. Optimal hyperspectral narrowband (OHNB) analysis. For FSA, we used 59 DESIS four-bin product bands and 207 of 238 PRISMA bands. For OHNB analysis, 9 DESIS and 16 PRISMA nonredundant OHNBs for studying crops were selected. FSA achieved only 1% to 3% higher accuracies relative to OHNB analysis in most cases. SVM provided the best results, closely followed by RF. Using both DESIS and PRISMA image OHNBs in SVM for classification led to higher accuracy than using either image alone, with an overall accuracy of 99%, producer’s accuracies of 94% to 100%, and user???s accuracies of 95% to 100%.",,,12,2024-11-01
Assessing the Utility of Uncrewed Aerial System Photogrammetrically Derived Point Clouds for Land Cover Classification in the Alaska North Slope,"Liu, Jung-kuan; Qin, Rongjun; Arundel, Samantha T.",pp. 405-414(10),Open Access content,https://www.ingentaconnect.com/contentone/asprs/pers/2024/00000090/00000007/art00009;jsessionid=8r5ofsaiftek3.x-ic-live-02,"Uncrewed aerial systems (UASs) have been used to collect “pseudo field plot” data in the form of large-scale stereo imagery to supplement and bolster direct field observations to monitor areas in Alaska. These data supplement field data that is difficult to collect in such a vast landscape with a relatively short field season. Dense photogrammetrically derived point clouds are created and are facilitated to extract land cover data using a support vector machine (SVM) classifier in this study. We test our approach using point clouds derived from 1-cm stereo imagery of plots in the Alaska North Slope region and compare the results to field observations. The results show that the overall accuracy of six land cover classes (bare soil, shrub, grass, forb/herb, rock, and litter) is 96.8% from classified patches. Shrub had the highest accuracy (>99%) and forb/herb achieved the lowest (<48%). This study reveals that the approach could be used as reference data to check field observations in remote areas.",,,12,2024-07-01
An Improved YOLO Network for Insulator and Insulator Defect Detection in UAV Images,"Zhou, Fangrong; Liu, Lifeng; Hu, Hao; Jin, Weishi; Zheng, Zezhong; Li, Zhongnian; Ma, Yi; Wang, Qun",pp. 355-361(7),Subscribed content,https://www.ingentaconnect.com/contentone/asprs/pers/2024/00000090/00000006/art00009;jsessionid=ehe231hgm4fh1.x-ic-live-03,"The power grid plays a vital role in the construction of livelihood projects by transmitting electrical energy. In the event of insulator explosions on power grid towers, these insulators may detach, presenting potential safety risks to transmission lines. The identification of such failures relies on the examination of images captured by unmanned aerial vehicles (UAVs). However, accurately detecting insulator defects remains challenging, particularly when dealing with variations in size. Existing methods exhibit limited accuracy in detecting small objects. In this paper, we propose a novel detection method that incorporates the convolutional block attention module (CBAM) as an attention mechanism into the backbone of the ""you only look once"" version 5 (YOLOv5) model. Additionally, we integrate a residual structure into the model to learn additional information and features related to insulators, thereby enhancing detection efficiency. Experimental results demonstrate that our proposed method achieved F1 scores of 0.87 for insulator detection and 0.89 for insulator defect detection. The improved YOLOv5 network shows promise in detecting insulators and their defects in UAV images.",,,10,2024-06-01
Real-Time Cross-View Image Matching and Camera Pose Determination for Unmanned Aerial Vehicles,"Chen, Long; Wu, Bo; Duan, Ran; Chen, Zeyu",pp. 371-381(11),Open Access content,https://www.ingentaconnect.com/contentone/asprs/pers/2024/00000090/00000006/art00012;jsessionid=ehe231hgm4fh1.x-ic-live-03,"In global navigation satellite systems (GNSS)-denied environments, vision-based methods are commonly used for the positioning and navigation of aerial robots. However, traditional methods often suffer from accumulative estimation errors over time, leading to trajectory drift and lack real-time performance, particularly in large-scale scenarios. This article presents novel approaches, including feature-based cross-view image matching and the integration of visual odometry and photogrammetric space resection for camera pose determination in real-time. Experimental evaluation with real UAV datasets demonstrated that the proposed method reliably matches features in cross-view images with large differences in spatial resolution, coverage, and perspective views, achieving a root-mean-square error of 4.7 m for absolute position error and 0.33° for rotation error, and delivering real-time performance of 12 frames per second (FPS) when implemented in a lightweight edge device onboard UAV. This approach offters potential for diverse intelligent UAV applications in GNSS-denied environments based on real-time feedback control.",,,9,2024-06-01
Monitoring LULC Changes in Babil Province for Sustainable Development Purposes Within the Period 2004–2023,"Jassoom, Hayder Hameed; Abdoon, Rabab Saadoon",pp. 745-753(9),Open Access content,https://www.ingentaconnect.com/contentone/asprs/pers/2024/00000090/00000012/art00010;jsessionid=9a8ib0ew1wvq.x-ic-live-03,"Land use and land cover studies are fundamental to achieving sustainable development goals by providing the information necessary for informed decision-making in social and economic development and natural resource management. This study relied on remote sensing data to analyze and assess land use and land cover changes in Babil Province, Iraq, over the past two decades. The study focused on identifying the patterns and factors influencing these changes, using Landsat satellite imagery to create digital maps classifying land into four main categories: urban lands, bare soil lands, water bodies, and vegetation lands. The results showed a noticeable expansion of urban lands at the expense of bare soil lands, primarily attributed to population growth, economic development, and improved security conditions. This study underscores the importance of sustainable land management and urban planning in Babil Province. These results highlight the importance of sustainable land management in Babil Province, including sound urban planning considering urban expansion's environmental, social, and economic effects. The classification was implemented using a maximum likelihood classifier, and the accuracy assessment yielded satisfactory results with an overall accuracy of 93.5517%. This study encourages using artificial intelligence to track and analyze land use changes in Babil.",,,7,2024-12-01
One-Dimensional-Mixed Convolution Neural Network and Covariance Pooling Model for Mineral Mapping of Porphyry Copper Deposit Using PRISMA Hyperspectral Data,"Peyghambari, Sima; Zhang, Yun; Heidarian, Hassan; Sekandari, Milad",pp. 511-522(12),Open Access content,https://www.ingentaconnect.com/contentone/asprs/pers/2024/00000090/00000008/art00014;jsessionid=7uf52f85n58hq.x-ic-live-01,"Mapping distribution of alterations around porphyry copper deposits (PCDs) greatly affects mineral exploration. Diverse geological processes generate irregular alteration patterns with diverse spectral characteristics in mineral deposits. Applying remotely sensed hyperspectral images (HSIs) is an appealing technology for geologic surveyors to generate alteration maps. Conventional methods mainly use shallow spectral absorption features to discriminate minerals and cannot extract their important spectral information. Deep neural networks with nonlinear layers can evoke the deep spectral and spatial information of HSIs. Deep learning???based methods include fully connected neural networks, convolutional neural networks, and hybrid convolutional networks like mixed convolution neural network and covariance pooling (MCNN‐CP) algorithms. However, each has its advantages and limitations. To significantly avoid losing important spectral features, we proposed a new method by fusing a one‐dimensional convolutional neural network (1D‐CNN) with MCNN‐CP (1D‐MCNN‐CP), achieving an overall accuracy (97.44%) of mineral mapping from PRISMA HSIs. This research deduced that 1D‐MCNN‐CP improved performance and reduced misclassification errors among minerals sharing similar spectral features.",,,6,2024-08-01
Morphology-Based Feature Extraction Network for Arbitrary-Oriented SAR Vehicle Detection,"Chen, Ting; Huang, Xiaohong",pp. 665-673(9),Subscribed content,https://www.ingentaconnect.com/contentone/asprs/pers/2024/00000090/00000011/art00010;jsessionid=vj4y1qllys3s.x-ic-live-02,"In recent years, synthetic aperture radar (SAR) vehicle detection has become a research hotspot. However, algorithms using horizontal bounding boxes can lead to redundant detection areas due to the varying aspect ratio and arbitrary orientation of vehicle targets. This paper proposes a morphology-based feature extraction network (MFE-Net), which fully uses the prior shape knowledge of the vehicle targets. Specifically, we adopt rotatable bounding boxes to predict the targets, and a novel rectangular rotation-invariant coordinate convolution (RRICC) is proposed to extract the feature, which can determine more accurately the convolutional sampling location of the vehicles. The adaptive thresholding denoising module (ATDM) is designed to suppress background clutter. Furthermore, inspired by the convolutional neural networks (CNNs) and self-attention, we propose the hybrid representation enhancement module (HREM) to highlight the vehicle target features. The experiment results show that the proposed model obtains an average precision (AP) of 93.1% on the SAR vehicle detection data set (SVDD).",,,6,2024-11-01
Land Use Change in the Yangtze River Economic Belt during 2010 to 2020 and Future Comprehensive Prediction Based on Markov and ARIMA Models,"Zheng, Haotian; Yu, Fan; Wan, Huawei; Shi, Peirong; Wang, Haonan",pp. 345-354(10),Subscribed content,https://www.ingentaconnect.com/contentone/asprs/pers/2024/00000090/00000006/art00007;jsessionid=ehe231hgm4fh1.x-ic-live-03,"The key data for accurate prediction is of great significance to accurately carry out the next step of sustainable land use development plan according to the demand of China. Consequently, the main purposes of our study are: (1) to delineate the characteristics of land use transitions within the Yangtze River Economic Belt; (2) to use the Markov model and the autoregressive integrated moving average (ARIMA) model for comparative analysis and prediction of land use distribution. This study analyzes land use/cover change (LUCC) data from 2010 and 2020 using the land use transition matrix, dynamic degree, and comprehensive index model and predicts 2025 land use by the Markov model. The study identifies a reduction in land usage over 11 years, particularly in grassland. The Markov and ARIMA models' significance is 0.002 (P < 0.01), showing arable land and woodland dominance, with varying changes in other land types.",,,6,2024-06-01
Semantic Segmentation of Point Cloud Scene via Multi-Scale Feature Aggregation and Adaptive Fusion,"Guo, Baoyun; Sun, Xiaokai; Li, Cailin; Sun, Na; Wang, Yue; Yao, Yukai",pp. 553-563(11),Subscribed content,https://www.ingentaconnect.com/contentone/asprs/pers/2024/00000090/00000009/art00009;jsessionid=1mbv2n6m4be2x.x-ic-live-03,"Point cloud semantic segmentation is a key step in 3D scene understanding and analysis. In recent years, deep learning–based point cloud semantic segmentation methods have received extensive attention from researchers. Multi-scale neighborhood feature learning methods are suitable for inhomogeneous density point clouds, but different scale branching feature learning increases the computational complexity and makes it difficult to accurately fuse different scale features to express local information. In this study, a point cloud semantic segmentation network based on RandLA-Net with multi-scale local feature aggregation and adaptive fusion is proposed. The designed structure can reduce computational complexity and accurately express local features. The mean intersection-over-union is improved by 1.1% on the SemanticKITTI data set with an inference speed of nine frames per second, while the mean intersection-over-union is improved by 0.9% on the S3DIS data set, compared with RandLA-Net. We also conduct ablation studies to validate the effectiveness of the proposed key structure.",,,5,2024-09-01
Parcel-Level Crop Classification in Plain Fragmented Regions Based on Multi-Source Remote Sensing Images,"Zhang, Qiao; Luo, Ziyi; Shen, Yang; Wang, Zhoufeng",pp. 293-302(10),Subscribed content,https://www.ingentaconnect.com/contentone/asprs/pers/2024/00000090/00000005/art00008;jsessionid=3dikh5526kvw9.x-ic-live-01,"Accurately obtaining crop cultivation extent and estimating the cultivated area are significant for adjusting regional planting structure. This article proposes a parcel-level crop classification method using time-series, medium-resolution, remote sensing images and single-phase, high-spatial-resolution, remote sensing images. The deep learning semantic segmentation network feature pyramid network with squeeze-and-excitation network (FPN???SENet) and multi-scale segmentation were used to extract cultivated land parcels from Gaofen-2 imagery, while the pixel-level crop types were classified by using support vector machine algorithms from time-series Sentinel-2 images. Then, the parcel-level crop classification was obtained from the pixel-level crop types and land parcels.",,,5,2024-05-01
Evaluation of SMAP and CYGNSS Soil Moistures in Drought Prediction Using Multiple Linear Regression and GLDAS Product,"Edokossi, Komi; Jin, Shuanggen; Calabia, Andres; Molina, Iñigo; Mazhar, Usman",pp. 303-312(10),Subscribed content,https://www.ingentaconnect.com/contentone/asprs/pers/2024/00000090/00000005/art00009;jsessionid=3dikh5526kvw9.x-ic-live-01,"Drought is a devastating natural hazard and exerts profound effects on both the environment and society. Predicting drought occurrences is significant in aiding decision-making and implementing effective mitigation strategies. In regions characterized by limited data availability, such as Southern Africa, the use of satellite remote sensing data promises an excellent opportunity for achieving this predictive goal. In this article, we assess the effectiveness of Soil Moisture Active Passive (SMAP) and Cyclone Global Navigation Satellite System (CYGNSS) soil moisture data in predicting drought conditions using multiple linear regression???predicted data and Global Land Data Assimilation System (GLDAS) soil moisture data.",,,5,2024-05-01
"Monitoring an Ecosystem in Crisis: Measuring Seagrass Meadow Loss Using Deep Learning in Mosquito Lagoon, Florida","Insalaco, Stephanie A.; Herrero, Hannah V.; Limber, Russ; Oliver, Clancy; Wolfson, William B.",pp. 363-370(8),Open Access content,https://www.ingentaconnect.com/contentone/asprs/pers/2024/00000090/00000006/art00011;jsessionid=ehe231hgm4fh1.x-ic-live-03,"The ecosystem of Mosquito Lagoon, Florida, has been rapidly deteriorating since the 2010s, with a notable decline in keystone seagrass species. Seagrass is vital for many species in the lagoon, but nutrient overloading, algal blooms, boating, manatee grazing, and other factors have led to its loss. To understand this decline, a deep neural network analyzed Landsat imagery from 2000 to 2020. Results showed significant seagrass loss post-2013, coinciding with the 2011–2013 super algal bloom. Seagrass abundance varied annually, with the model performing best in years with higher seagrass coverage. While the deep learning method successfully identified seagrass, it also revealed that recent seagrass coverage is almost non-existent. This monitoring approach could aid in ecosystem recovery if coupled with appropriate policies for Mosquito Lagoon's restoration.",,,4,2024-06-01
Bank Line Extraction by Integration of Orthoimages and Lidar Digital Elevation Model Using Principal Component Analysis and Alpha Matting,"Deshpande, Sagar S.",pp. 631-638(8),Open Access content,https://www.ingentaconnect.com/contentone/asprs/pers/2024/00000090/00000010/art00013;jsessionid=27o0mw2ek145f.x-ic-live-03,"Riverbank lines change over time, causing loss of land and property. Accurate mapping of riverbank lines is essential for restoration and preservation. This paper presents a method to map riverbank lines by combining georeferenced orthoimages and lidar digital elevation model (DEM). This method uses the properties that lidar can provide elevations under trees and open water edges are visible in orthoimages to extract the planimetric locations of bank lines. The orthoimage pixels with less than 0.15% slope on the DEM were replaced by water pixels. Principal component analysis (PCA) was conducted using DEM, slope, and orthoimage bands. Training data of river body and the background were identified manually on the first three component images. An alpha matting–based method was implemented using the training data to extract the bank lines. Bankline using α value of 50% probability were statistically and visually better when compared to the manual bank lines.",,,4,2024-10-01
Research Progress of Optical Satellite Remote Sensing Monitoring Asphalt Pavement Aging,"Wang, Jingwen; Yang, Dayong; Xie, Zhiwei; Wang, Han; Hao, Zhigang; Zhou, Fanyu; Wang, Xiaona",pp. 471-482(12),Subscribed content,https://www.ingentaconnect.com/contentone/asprs/pers/2024/00000090/00000008/art00007;jsessionid=7uf52f85n58hq.x-ic-live-01,"The aging condition of asphalt pavement is an invaluable basis for traffic infrastructure evaluation. Due to the amount of time and high cost of monitoring and identifying asphalt pavement aging, many current studies focus on satellite remote sensing methods. In this paper, some methods and technologies for monitoring asphalt pavement degradation by optical satellite remote sensing are introduced as a literature review. Many researchers have developed spectrum libraries based on the actual aging of asphalt pavements, and it is possible to construct pavement health indices based on spectrum changes. Some indexes can extract different aging degrees of asphalt pavement from optical satellite images. Of course, current research can only preliminarily reflect the aging phenomenon of asphalt pavement and cannot accurately describe the distress characteristics of asphalt pavement. Future research needs to further strengthen mechanism research, develop higher resolution images, improve image processing technology, and adopt multi-means fusion analysis methods.",,,4,2024-08-01
ReLAP-Net: Residual Learning and Attention Based Parallel Network for Hyperspectral and Multispectral Image Fusion,"Agrawal, Aditya; SourajaKundu; Ahmad, Touseef; Bhatt, Manish",pp. 395-403(9),Subscribed content,https://www.ingentaconnect.com/contentone/asprs/pers/2024/00000090/00000007/art00007;jsessionid=8r5ofsaiftek3.x-ic-live-02,Remote sensing applications require high-resolution images to obtain precise information about the Earth???s surface. Multispectral images have high spatial resolution but low spectral resolution. Hyperspectral images have high spectral resolution but low spatial resolution. This study proposes a residual learning and attention-based parallel network based on residual network and channel attention. The network performs image fusion of a high spatial resolution multispectral image and a low spatial resolution hyperspectral image. The network training and fusion experiments are conducted on four public benchmark data sets to show the effectiveness of the proposed model. The fusion performance is compared with classical signal processing???based image fusion techniques. Four image metrics are used for the quantitative evaluation of the fused images. The proposed network improved fusion ability by reducing the root mean square error and relative dimensionless global error in synthesis and increased the peak signal-to-noise ratio when compared to other state-of-the-art models.,,,4,2024-07-01
Individual Tree Segmentation Using Deep Learning and Climbing Algorithm: A Method for Achieving High-precision Single-tree Segmentation in High-density Forests under Complex Environments,"Ma, He; Zhang, Fangmin; Chen, Simin; Yu, Jinge",pp. 101-110(10),,https://www.ingentaconnect.com/contentone/asprs/pers/2025/00000091/00000002/art00011;jsessionid=oun1mw0p67lv.x-ic-live-03,"Accurate individual tree segmentation, which is important for forestry investigation, is still a difficult and challenging task. In this study, we developed a climbing algorithm and combined it with a deep learning model to extract forests and achieve individual tree segmentation using lidar point clouds. We tested the algorithm on mixed forests within complex environments scanned by unmanned aircraft system lidar in ecological restoration mining areas along the Yangtze River of China. Quantitative assessments of the segmentation results showed that the forest extraction achieved a kappa coefficient of 0.88, and the individual tree segmentation results achieved F-scores ranging from 0.86 to 1. The climbing algorithm successfully reduced false positives and false negatives with the increased crown overlapping and outperformed the widely used top-down region-growing point cloud segmentation method. The results indicate that the climbing algorithm proposed in this study will help solve the overlapped crown problem of tree segmentation under complex environments.",,,4,2025-02-01
Accuracy Assessment of Dense Point Cloud Generated by Deep Learning and Semiglobal Matching,"Sadeq, Haval Abduljabbar",pp. 153-162(10),,https://www.ingentaconnect.com/contentone/asprs/pers/2025/00000091/00000003/art00010;jsessionid=jm2wajzzvth3.x-ic-live-02,"This study assesses two techniques for generating point clouds based on dense image matching (DIM): semiglobal matching (SGM) implemented in Trimble INPHO MATCH-3DX software, and a deep-learning algorithm Pyramid Stereo Matching Network (PSMNet). The PSMNet was trained using three datasets with both automated driving and aerial scenes. Two other distinctive sites were selected to assess the accuracy against LiDAR data. The study found inaccuracies in the PSMNet point clouds and suggested that SGM could potentially result in a better outcome. However, for flat slab or ground surface, its root-mean-square error is better than SGM. The analysis showed that the SGM analyses favorably remove points on vertical surfaces due to occlusion, while PSMNet incorrectly extrapolate them with slopes. Furthermore, the assessment identified the potential to improve PSMNet by using more or in-distribution training dataset for test (unseen) areas.",,,4,2025-03-01
